{"$schema":"https://json-schema.org/draft/2020-12/schema","type":"object","required":["schemaVersion","frameworkId","generatedAt","topics","businessHash"],"properties":{"schemaVersion":{"type":"string"},"frameworkId":{"type":"string"},"generatedAt":{"type":"string","format":"date-time"},"topics":{"type":"array","items":{"type":"object","required":["id","frameworkId","type","title","learningStatus","sourceCommit","catalogRootHash","symbolRootHash"],"properties":{"id":{"type":"string"},"frameworkId":{"type":"string"},"type":{"type":"string"},"title":{"type":"string"},"learningStatus":{"type":"string"},"sourceCommit":{"type":"string"},"catalogRootHash":{"type":"string"},"symbolRootHash":{"type":"string"}}}},"businessHash":{"type":"string","pattern":"^sha256:[a-f0-9]{64}$"}}}
