{
  "schemaVersion": "1.0.0",
  "frameworkId": "ncom",
  "generatedAt": "2026-07-28T03:27:49.025Z",
  "topics": [
    {
      "id": "package-public-exports",
      "frameworkId": "ncom",
      "type": "framework_concept",
      "title": "NCom package and public export structure",
      "description": "Learn package boundaries and public exports.",
      "packageIds": [
        "package-ncom-all",
        "package-ncom-components",
        "package-ncom-core"
      ],
      "symbolIds": [],
      "componentIds": [],
      "documentSectionIds": [],
      "exampleIds": [],
      "prerequisiteTopicIds": [],
      "priority": 100,
      "learningStatus": "published",
      "sourceCommit": "a350b576bbeae6c6254273037a17d2a8730fb80f",
      "catalogRootHash": "sha256:0dbfa378eedaaef0b31867b679e7932157eb63bb0cc4e3fa0fb0a0d1869c6518",
      "symbolRootHash": "sha256:52e4461d185ce375263aca5e412b2d93f402d906867bf0940bffc9807eec6297",
      "coverageTargets": [
        "package",
        "public_symbol"
      ],
      "warnings": []
    },
    {
      "id": "component-base-model",
      "frameworkId": "ncom",
      "type": "framework_concept",
      "title": "NComponent and defineComponent base model",
      "description": "Learn base component and registration facts.",
      "packageIds": [],
      "symbolIds": [
        "symbol-fca3708ca106bc60",
        "symbol-ce1be56437963bb3"
      ],
      "componentIds": [],
      "documentSectionIds": [],
      "exampleIds": [],
      "prerequisiteTopicIds": [],
      "priority": 99,
      "learningStatus": "published",
      "sourceCommit": "a350b576bbeae6c6254273037a17d2a8730fb80f",
      "catalogRootHash": "sha256:0dbfa378eedaaef0b31867b679e7932157eb63bb0cc4e3fa0fb0a0d1869c6518",
      "symbolRootHash": "sha256:52e4461d185ce375263aca5e412b2d93f402d906867bf0940bffc9807eec6297",
      "coverageTargets": [
        "component",
        "lifecycle"
      ],
      "warnings": []
    },
    {
      "id": "event-system",
      "frameworkId": "ncom",
      "type": "event_system",
      "title": "NCom event system",
      "description": "Learn observable component event facts.",
      "packageIds": [],
      "symbolIds": [
        "symbol-4ef0a65933001699"
      ],
      "componentIds": [],
      "documentSectionIds": [],
      "exampleIds": [],
      "prerequisiteTopicIds": [],
      "priority": 95,
      "learningStatus": "published",
      "sourceCommit": "a350b576bbeae6c6254273037a17d2a8730fb80f",
      "catalogRootHash": "sha256:0dbfa378eedaaef0b31867b679e7932157eb63bb0cc4e3fa0fb0a0d1869c6518",
      "symbolRootHash": "sha256:52e4461d185ce375263aca5e412b2d93f402d906867bf0940bffc9807eec6297",
      "coverageTargets": [
        "event"
      ],
      "warnings": []
    },
    {
      "id": "ncbutton-api",
      "frameworkId": "ncom",
      "type": "component",
      "title": "NCButton API and usage patterns",
      "description": "Learn NCButton public API and event usage.",
      "packageIds": [],
      "symbolIds": [
        "symbol-4ef0a65933001699",
        "symbol-c7b514bbc7b95fb6"
      ],
      "componentIds": [
        "component-6279f9bfe1af1227"
      ],
      "documentSectionIds": [],
      "exampleIds": [],
      "prerequisiteTopicIds": [
        "component-base-model",
        "event-system"
      ],
      "priority": 94,
      "learningStatus": "published",
      "sourceCommit": "a350b576bbeae6c6254273037a17d2a8730fb80f",
      "catalogRootHash": "sha256:0dbfa378eedaaef0b31867b679e7932157eb63bb0cc4e3fa0fb0a0d1869c6518",
      "symbolRootHash": "sha256:52e4461d185ce375263aca5e412b2d93f402d906867bf0940bffc9807eec6297",
      "coverageTargets": [
        "component",
        "public_symbol",
        "example"
      ],
      "warnings": []
    },
    {
      "id": "ncinput-events",
      "frameworkId": "ncom",
      "type": "component",
      "title": "NCInput API and value change event",
      "description": "Learn NCInput API and public value-change usage.",
      "packageIds": [],
      "symbolIds": [
        "symbol-a99fecb6fdc985b4"
      ],
      "componentIds": [
        "component-79de77ea33744632"
      ],
      "documentSectionIds": [],
      "exampleIds": [],
      "prerequisiteTopicIds": [
        "component-base-model"
      ],
      "priority": 93,
      "learningStatus": "published",
      "sourceCommit": "a350b576bbeae6c6254273037a17d2a8730fb80f",
      "catalogRootHash": "sha256:0dbfa378eedaaef0b31867b679e7932157eb63bb0cc4e3fa0fb0a0d1869c6518",
      "symbolRootHash": "sha256:52e4461d185ce375263aca5e412b2d93f402d906867bf0940bffc9807eec6297",
      "coverageTargets": [
        "component",
        "event"
      ],
      "warnings": []
    },
    {
      "id": "example-workflow",
      "frameworkId": "ncom",
      "type": "development_workflow",
      "title": "Example addition and registration workflow",
      "description": "Learn example directory, registration and validated build flow.",
      "packageIds": [],
      "symbolIds": [],
      "componentIds": [],
      "documentSectionIds": [],
      "exampleIds": [],
      "prerequisiteTopicIds": [],
      "priority": 92,
      "learningStatus": "published",
      "sourceCommit": "a350b576bbeae6c6254273037a17d2a8730fb80f",
      "catalogRootHash": "sha256:0dbfa378eedaaef0b31867b679e7932157eb63bb0cc4e3fa0fb0a0d1869c6518",
      "symbolRootHash": "sha256:52e4461d185ce375263aca5e412b2d93f402d906867bf0940bffc9807eec6297",
      "coverageTargets": [
        "example",
        "workflow"
      ],
      "warnings": []
    },
    {
      "id": "build-workflow",
      "frameworkId": "ncom",
      "type": "build_workflow",
      "title": "Theme and example build verification workflow",
      "description": "Learn validated build ordering.",
      "packageIds": [],
      "symbolIds": [],
      "componentIds": [],
      "documentSectionIds": [],
      "exampleIds": [],
      "prerequisiteTopicIds": [],
      "priority": 91,
      "learningStatus": "planned",
      "sourceCommit": "a350b576bbeae6c6254273037a17d2a8730fb80f",
      "catalogRootHash": "sha256:0dbfa378eedaaef0b31867b679e7932157eb63bb0cc4e3fa0fb0a0d1869c6518",
      "symbolRootHash": "sha256:52e4461d185ce375263aca5e412b2d93f402d906867bf0940bffc9807eec6297",
      "coverageTargets": [
        "workflow"
      ],
      "warnings": []
    },
    {
      "id": "lifecycle-callbacks",
      "frameworkId": "ncom",
      "type": "lifecycle",
      "title": "NCom lifecycle callback structure",
      "description": "Record commit-bound lifecycle callback declarations without inferring runtime order.",
      "packageIds": [],
      "symbolIds": [
        "symbol-fca3708ca106bc60"
      ],
      "componentIds": [],
      "documentSectionIds": [],
      "exampleIds": [],
      "prerequisiteTopicIds": [],
      "priority": 89,
      "learningStatus": "published",
      "sourceCommit": "a350b576bbeae6c6254273037a17d2a8730fb80f",
      "catalogRootHash": "sha256:0dbfa378eedaaef0b31867b679e7932157eb63bb0cc4e3fa0fb0a0d1869c6518",
      "symbolRootHash": "sha256:52e4461d185ce375263aca5e412b2d93f402d906867bf0940bffc9807eec6297",
      "coverageTargets": [
        "lifecycle",
        "public_symbol"
      ],
      "warnings": []
    },
    {
      "id": "template-rendering",
      "frameworkId": "ncom",
      "type": "framework_concept",
      "title": "NCom template and rendering structure",
      "description": "Record bounded template and rendering symbols.",
      "packageIds": [],
      "symbolIds": [
        "symbol-fca3708ca106bc60"
      ],
      "componentIds": [],
      "documentSectionIds": [],
      "exampleIds": [],
      "prerequisiteTopicIds": [],
      "priority": 88,
      "learningStatus": "published",
      "sourceCommit": "a350b576bbeae6c6254273037a17d2a8730fb80f",
      "catalogRootHash": "sha256:0dbfa378eedaaef0b31867b679e7932157eb63bb0cc4e3fa0fb0a0d1869c6518",
      "symbolRootHash": "sha256:52e4461d185ce375263aca5e412b2d93f402d906867bf0940bffc9807eec6297",
      "coverageTargets": [
        "template",
        "render"
      ],
      "warnings": []
    },
    {
      "id": "props-reflection",
      "frameworkId": "ncom",
      "type": "framework_concept",
      "title": "NCom props declaration and reflection structure",
      "description": "Record bounded props and observed attributes evidence.",
      "packageIds": [],
      "symbolIds": [],
      "componentIds": [],
      "documentSectionIds": [],
      "exampleIds": [],
      "prerequisiteTopicIds": [],
      "priority": 87,
      "learningStatus": "published",
      "sourceCommit": "a350b576bbeae6c6254273037a17d2a8730fb80f",
      "catalogRootHash": "sha256:0dbfa378eedaaef0b31867b679e7932157eb63bb0cc4e3fa0fb0a0d1869c6518",
      "symbolRootHash": "sha256:52e4461d185ce375263aca5e412b2d93f402d906867bf0940bffc9807eec6297",
      "coverageTargets": [
        "props",
        "public_symbol"
      ],
      "warnings": []
    },
    {
      "id": "theme-style-entry",
      "frameworkId": "ncom",
      "type": "styling",
      "title": "NCom theme and component style entry structure",
      "description": "Record theme package and component style entry evidence.",
      "packageIds": [
        "package-ncom-theme"
      ],
      "symbolIds": [],
      "componentIds": [],
      "documentSectionIds": [],
      "exampleIds": [],
      "prerequisiteTopicIds": [],
      "priority": 86,
      "learningStatus": "published",
      "sourceCommit": "a350b576bbeae6c6254273037a17d2a8730fb80f",
      "catalogRootHash": "sha256:0dbfa378eedaaef0b31867b679e7932157eb63bb0cc4e3fa0fb0a0d1869c6518",
      "symbolRootHash": "sha256:52e4461d185ce375263aca5e412b2d93f402d906867bf0940bffc9807eec6297",
      "coverageTargets": [
        "style",
        "theme"
      ],
      "warnings": []
    },
    {
      "id": "template-shadow-dom",
      "frameworkId": "ncom",
      "type": "lifecycle",
      "title": "Component templates and Shadow DOM",
      "description": "Learn observed template and component rendering facts.",